{
  "artifacts": [
    {
      "artifact_id": "pq-devpack-readme",
      "artifact_type": "readme",
      "authority": "prompt-quarry",
      "claims": [
        "engineered",
        "valid"
      ],
      "distribution": {
        "customer_visible": true,
        "include": true,
        "notes": "Customer-facing package overview.",
        "redistributable": true
      },
      "evidence_refs": [
        ".ci/developer-pack-v1/latest.json"
      ],
      "maturity_state": "VALID",
      "path": "product/developer-pack-v1/README.md",
      "provenance_class": "product-authored",
      "sha256": "sha256:5f9b7adc3e0c117d5138000b3bb5b4db7e56659e6222cb87ee3834b3f2e091c4"
    },
    {
      "artifact_id": "pq-devpack-quickstart",
      "artifact_type": "quickstart",
      "authority": "prompt-quarry",
      "claims": [
        "engineered",
        "valid"
      ],
      "distribution": {
        "customer_visible": true,
        "include": true,
        "notes": "Five-minute customer workflow.",
        "redistributable": true
      },
      "evidence_refs": [
        ".ci/developer-pack-v1/latest.json"
      ],
      "maturity_state": "VALID",
      "path": "product/developer-pack-v1/QUICKSTART.md",
      "provenance_class": "product-authored",
      "sha256": "sha256:7be700dbd830b843ce85cf5462359917be2bed9917c0ce3618604a121a7655d4"
    },
    {
      "artifact_id": "pq-methodology-architecture",
      "artifact_type": "methodology",
      "authority": "prompt-quarry",
      "claims": [
        "engineered",
        "valid"
      ],
      "distribution": {
        "customer_visible": true,
        "include": true,
        "notes": "Prompt architecture design method.",
        "redistributable": true
      },
      "evidence_refs": [
        ".ci/developer-pack-v1/latest.json"
      ],
      "maturity_state": "VALID",
      "path": "product/developer-pack-v1/methodology/architecture.md",
      "provenance_class": "mk1-derived",
      "sha256": "sha256:8d8f1c6e160a7dfb0ae2e275f989cdd8e2a7aad430f36a156dcb53c83e27672c",
      "source_refs": [
        "mk1/specs/PROMPT_ARTIFACT.schema.json",
        "tools/mk1_prompt_generator_v0.py"
      ]
    },
    {
      "artifact_id": "pq-methodology-evidence-states",
      "artifact_type": "methodology",
      "authority": "prompt-quarry",
      "claims": [
        "engineered",
        "valid"
      ],
      "distribution": {
        "customer_visible": true,
        "include": true,
        "notes": "Evidence-state definitions and claim discipline.",
        "redistributable": true
      },
      "evidence_refs": [
        ".ci/developer-pack-v1/latest.json"
      ],
      "maturity_state": "VALID",
      "path": "product/developer-pack-v1/methodology/evidence-states.md",
      "provenance_class": "mk1-derived",
      "sha256": "sha256:3831ed9198dd8b68e7c67c1ca2f25e07a1903cee3dd2fae4992cbb06556279c8",
      "source_refs": [
        "product/developer-pack-v1/SPEC.md"
      ]
    },
    {
      "artifact_id": "pq-methodology-evaluation",
      "artifact_type": "methodology",
      "authority": "prompt-quarry",
      "claims": [
        "engineered",
        "valid"
      ],
      "distribution": {
        "customer_visible": true,
        "include": true,
        "notes": "Static and runtime evaluation method.",
        "redistributable": true
      },
      "evidence_refs": [
        ".ci/developer-pack-v1/latest.json"
      ],
      "maturity_state": "VALID",
      "path": "product/developer-pack-v1/methodology/evaluation.md",
      "provenance_class": "mk1-derived",
      "sha256": "sha256:f27296984353c26fe24c4915b1a56fba83abd5b37655cbedff97b89afbac26a4",
      "source_refs": [
        "product/developer-pack-v1/SPEC.md"
      ]
    },
    {
      "artifact_id": "pq-contract-task-brief-example",
      "artifact_type": "task-brief-example",
      "authority": "prompt-quarry",
      "claims": [
        "engineered",
        "valid"
      ],
      "distribution": {
        "customer_visible": true,
        "include": true,
        "notes": "Customer-facing normalized task brief example.",
        "redistributable": true
      },
      "evidence_refs": [
        ".ci/developer-pack-v1/latest.json"
      ],
      "maturity_state": "VALID",
      "media_type": "application/json",
      "path": "product/developer-pack-v1/contracts/task-brief.example.json",
      "provenance_class": "example",
      "sha256": "sha256:2605dcbfbe1cd948d5d3b0a27564df0840baffa00e06467a0a828744072ab5d5",
      "source_refs": [
        "mk1/specs/TASK_BRIEF.schema.json"
      ]
    },
    {
      "artifact_id": "pq-contract-prompt-request-example",
      "artifact_type": "prompt-request-example",
      "authority": "prompt-quarry",
      "claims": [
        "engineered",
        "valid"
      ],
      "distribution": {
        "customer_visible": true,
        "include": true,
        "notes": "Customer-facing generator request example.",
        "redistributable": true
      },
      "evidence_refs": [
        ".ci/developer-pack-v1/latest.json"
      ],
      "maturity_state": "VALID",
      "media_type": "application/json",
      "path": "product/developer-pack-v1/contracts/prompt-request.example.json",
      "provenance_class": "example",
      "sha256": "sha256:53f4bd8a98c180280ac874aa8497940f7a971b7e768bcf605dfbf83dc2c8fe4d",
      "source_refs": [
        "mk1/specs/PROMPT_GENERATOR_REQUEST.schema.json"
      ]
    },
    {
      "artifact_id": "pq-template-general",
      "artifact_type": "prompt-template",
      "authority": "prompt-quarry",
      "claims": [
        "engineered",
        "valid"
      ],
      "distribution": {
        "customer_visible": true,
        "include": true,
        "notes": "General reusable structured prompt template.",
        "redistributable": true
      },
      "evidence_refs": [
        ".ci/developer-pack-v1/latest.json"
      ],
      "maturity_state": "VALID",
      "path": "product/developer-pack-v1/templates/general-structured-prompt.md",
      "prompt_family": "general_structured",
      "provenance_class": "mk1-derived",
      "sha256": "sha256:3658a19ff0b96acb47395d29a17faf305f204628ae8cc9fa2599d5d00987433a",
      "source_refs": [
        "mk1/specs/PROMPT_ARTIFACT.schema.json",
        "tools/mk1_prompt_generator_v0.py"
      ]
    },
    {
      "artifact_id": "pq-template-software-code-review",
      "artifact_type": "prompt-template",
      "authority": "prompt-quarry",
      "claims": [
        "engineered",
        "valid"
      ],
      "distribution": {
        "customer_visible": true,
        "include": true,
        "notes": "Software/code review template with evidence boundaries.",
        "redistributable": true
      },
      "evidence_refs": [
        ".ci/developer-pack-v1/latest.json"
      ],
      "maturity_state": "VALID",
      "path": "product/developer-pack-v1/templates/software-code-review.md",
      "prompt_family": "software_code_review",
      "provenance_class": "mk1-derived",
      "sha256": "sha256:310de8f405adbda63d417faab59dcb5171ed2daa02663f2a3b1d9b743db7acde",
      "source_refs": [
        "mk1/generator/examples/software-review.request.json",
        "tools/mk1_prompt_generator_v0.py"
      ]
    },
    {
      "artifact_id": "pq-template-technical-research-decision",
      "artifact_type": "prompt-template",
      "authority": "prompt-quarry",
      "claims": [
        "engineered",
        "valid"
      ],
      "distribution": {
        "customer_visible": true,
        "include": true,
        "notes": "Technical research and decision template.",
        "redistributable": true
      },
      "evidence_refs": [
        ".ci/developer-pack-v1/latest.json"
      ],
      "maturity_state": "VALID",
      "path": "product/developer-pack-v1/templates/technical-research-decision.md",
      "prompt_family": "research_technical_decision",
      "provenance_class": "mk1-derived",
      "sha256": "sha256:8796f53802693cd9eafb61092d0e2dec445f545fbc1796bf4c9030780a29eccc",
      "source_refs": [
        "mk1/specs/PROMPT_ARTIFACT.schema.json",
        "tools/mk1_prompt_generator_v0.py"
      ]
    },
    {
      "artifact_id": "pq-example-code-review-request",
      "artifact_type": "prompt-request-example",
      "authority": "prompt-quarry",
      "claims": [
        "engineered",
        "valid"
      ],
      "distribution": {
        "customer_visible": true,
        "include": true,
        "notes": "Code review example request.",
        "redistributable": true
      },
      "evidence_refs": [
        ".ci/developer-pack-v1/latest.json"
      ],
      "maturity_state": "VALID",
      "media_type": "application/json",
      "path": "product/developer-pack-v1/examples/software-code-review/request.json",
      "prompt_family": "software_code_review",
      "provenance_class": "example",
      "sha256": "sha256:892766198555fc36c6775985efa6605dae3ef3158454c65b2fa1a0c9aff467b1",
      "source_refs": [
        "mk1/specs/PROMPT_GENERATOR_REQUEST.schema.json"
      ]
    },
    {
      "artifact_id": "pq-example-code-review-brief",
      "artifact_type": "task-brief-example",
      "authority": "prompt-quarry",
      "claims": [
        "engineered",
        "valid"
      ],
      "distribution": {
        "customer_visible": true,
        "include": true,
        "notes": "Code review normalized task brief.",
        "redistributable": true
      },
      "evidence_refs": [
        ".ci/developer-pack-v1/latest.json"
      ],
      "maturity_state": "VALID",
      "media_type": "application/json",
      "path": "product/developer-pack-v1/examples/software-code-review/task-brief.json",
      "prompt_family": "software_code_review",
      "provenance_class": "example",
      "sha256": "sha256:1803d0cffa27898cd44c32b1c48ab6b1a75f0e807f0876dd5208adca020a7229",
      "source_refs": [
        "mk1/specs/TASK_BRIEF.schema.json"
      ]
    },
    {
      "artifact_id": "pq-example-code-review-prompt",